{
  "schema_version": "evidence/0",
  "tool": {
    "name": "sdlc-controls",
    "version": "0.2.0"
  },
  "change_id": "DEMO-t0-web-client",
  "binding_used": "git-native-baseline@1",
  "tier": "T0",
  "affected_set": [
    "web-client"
  ],
  "unmatched_set": [],
  "reasons": [
    "web-client criticality=low -> base T0"
  ],
  "controls_enforced": {
    "min_approvers": 1,
    "checks": [
      "lint"
    ],
    "deploy_approval": "standard"
  },
  "ai_assisted": false,
  "accountable_approver": "bob",
  "approver_ne_author": true,
  "approver_count": 1,
  "verification": {
    "approvers_supplied": true,
    "verified": [
      "CAF-SDLC-002:tier",
      "CAF-SDLC-011:approver-count",
      "CAF-SDLC-011:independent-approver"
    ],
    "recorded_not_verified": [
      "CAF-SDLC-010:ai-authorship",
      "required-checks",
      "deploy-approval"
    ]
  },
  "result": {
    "pass": true,
    "exit_code": 0,
    "violations": []
  },
  "map_version": 1,
  "computed_at": "2026-09-15T09:39:31.756914072Z"
}
